segment_id,text,start,duration,vid
1156,if we go down that road we all pay a,2655.26,5.22,sbE-emYnHJk
1157,price so I'm simply saying this let's,2658.32,5.85,sbE-emYnHJk
1158,invest in our prison system invest in,2660.48,6.36,sbE-emYnHJk
1159,rehabilitation invest crucially in a,2664.17,4.32,sbE-emYnHJk
1160,probation service that works,2666.84,3.78,sbE-emYnHJk
1161,it was privatized by this government ago,2668.49,3.27,sbE-emYnHJk
1162,we're saying it should have been,2670.62,2.79,sbE-emYnHJk
1163,completely in public owners just want to,2671.76,2.79,sbE-emYnHJk
1164,make sure you're answering a point he,2673.41,3.06,sbE-emYnHJk
1165,made mr. Johnson said to in this,2674.55,3.93,sbE-emYnHJk
1166,particular case it was not about,2676.47,3.51,sbE-emYnHJk
1167,resource it was not about the parole,2678.48,3.57,sbE-emYnHJk
1168,board of probation he says it was about,2679.98,4.83,sbE-emYnHJk
1169,sentences and you're opposed to the,2682.05,5.07,sbE-emYnHJk
1170,change he wants to make what I've said,2684.81,4.08,sbE-emYnHJk
1171,is there should be a review,2687.12,4.26,sbE-emYnHJk
1172,of the individual prisoner before,2688.89,5.16,sbE-emYnHJk
1173,release his countenance that I think is,2691.38,6.39,sbE-emYnHJk
1174,absolutely clear and that's why I asked,2694.05,6.27,sbE-emYnHJk
1175,for a role for both the parole board as,2697.77,4.77,sbE-emYnHJk
1176,well as the Probation Service in this,2700.32,4.17,sbE-emYnHJk
1177,because listen what happened was,2702.54,5.7,sbE-emYnHJk
1178,unbelievably appalling and therefore we,2704.49,5.67,sbE-emYnHJk
1179,have to keep people safe and secure but,2708.24,4.17,sbE-emYnHJk
1180,you don't do that by under investing in,2710.16,5.61,sbE-emYnHJk
1181,rehabilitation program well great,2712.41,5.64,sbE-emYnHJk
1182,inspector mr. Corben his Freddy's crew,2715.77,4.74,sbE-emYnHJk
1183,has consistently opposed longer,2718.05,5.88,sbE-emYnHJk
1184,sentences and when you look at mi5 the,2720.51,5.55,sbE-emYnHJk
1185,the body that keeps us safe particularly,2723.93,4.11,sbE-emYnHJk
1186,from from terror attacks he's proposing,2726.06,4.77,sbE-emYnHJk
1187,to put in a Home Secretary in the form,2728.04,5.01,sbE-emYnHJk
1188,of Diane Albert who is called for mi5 to,2730.83,7.29,sbE-emYnHJk
1189,be disbanded mr. Corbin great respect to,2733.05,9,sbE-emYnHJk
1190,him I do not when you look at the huge,2738.12,6.51,sbE-emYnHJk
1191,issues of safety on the on public street,2742.05,2.97,sbE-emYnHJk
1192,sir,2744.63,2.76,sbE-emYnHJk
1193,knife crime you have a Labor Party that,2745.02,5.31,sbE-emYnHJk
1194,is adamantly sceptical opposed to stop,2747.39,3.99,sbE-emYnHJk
1195,and search which I believe is an,2750.33,3.42,sbE-emYnHJk
1196,integral part of fighting crime on our,2751.38,3.96,sbE-emYnHJk
1197,streets and we're not only going to put,2753.75,3.18,sbE-emYnHJk
1198,"20,000 more officers on the streets of",2755.34,3.24,sbE-emYnHJk
1199,London we're gonna fight the streets of,2756.93,3.09,sbE-emYnHJk
1200,this country gonna fight crime in the,2758.58,3.03,sbE-emYnHJk
1201,way that I think in in London we're,2760.02,3.99,sbE-emYnHJk
1202,gonna back the police up let's get us in,2761.61,4.83,sbE-emYnHJk
1203,the government that cut the police force,2764.01,4.95,sbE-emYnHJk
1204,by such massive numbers privatized our,2766.44,5.01,sbE-emYnHJk
1205,probation service and got rid of all of,2768.96,5.01,sbE-emYnHJk
1206,our PCSOs in many parts of the country,2771.45,4.14,sbE-emYnHJk
1207,forgive me miss already you've made the,2773.97,3.48,sbE-emYnHJk
1208,point about cuts he's going to you is,2775.59,3.81,sbE-emYnHJk
1209,that your Home Secretary died neighbor,2777.45,5.79,sbE-emYnHJk
1210,wants to he claims you tell us wanted in,2779.4,6.09,sbE-emYnHJk
1211,the past at least a disband mi5 ever,2783.24,7.38,sbE-emYnHJk
1212,you've nosed so ever to disband mi5 or,2785.49,7.41,sbE-emYnHJk
1213,any other part of the security services,2790.62,4.89,sbE-emYnHJk
1214,there are plans to invest properly in,2792.9,4.98,sbE-emYnHJk
1215,our police and security services and,2795.51,4.59,sbE-emYnHJk
1216,when you live and represent an area like,2797.88,4.86,sbE-emYnHJk
1217,mine where somebody was murdered on the,2800.1,5.55,sbE-emYnHJk
1218,streets by a far-right terrorist attack,2802.74,5.49,sbE-emYnHJk
1219,on an individual you realize how,2805.65,4.23,sbE-emYnHJk
1220,horrific that is for the community and,2808.23,4.29,sbE-emYnHJk
1221,how dangerous that is for all of us yes,2809.88,5.4,sbE-emYnHJk
1222,we do need to invest in all of our,2812.52,4.92,sbE-emYnHJk
1223,services and that will help to make us,2815.28,3.96,sbE-emYnHJk
1224,all a lot safer gentlemen thank you very,2817.44,3.92,sbE-emYnHJk
1225,much indeed,2819.24,6.09,sbE-emYnHJk
1226,let us move on now to Toby Mayhew who,2821.36,6.34,sbE-emYnHJk
1227,has a question for us Toby may you,2825.33,5.4,sbE-emYnHJk
1228,please from accusations of Islamophobia,2827.7,5.25,sbE-emYnHJk
1229,and anti-semitism in major parties to,2830.73,4.5,sbE-emYnHJk
1230,threats made against female MPs what,2832.95,3.81,sbE-emYnHJk
1231,would you do to get the hate out of,2835.23,3.93,sbE-emYnHJk
1232,politics what would you do to get they,2836.76,4.08,sbE-emYnHJk
1233,hate out of politics,2839.16,4.05,sbE-emYnHJk
1234,Toby Mayhew hasn't he mentions,2840.84,5.04,sbE-emYnHJk
1235,Islamophobia anti-semitism and the,2843.21,6.3,sbE-emYnHJk
1236,threat against female MPs Boris Johnson,2845.88,4.95,sbE-emYnHJk
1237,I'm going to ask both you leaders to,2849.51,3.48,sbE-emYnHJk
1238,address problems in your own parties to,2850.83,4.41,sbE-emYnHJk
1239,begin with of course you may make one to,2852.99,5.54,sbE-emYnHJk
1240,make points about other party said well,2855.24,5.79,sbE-emYnHJk
1241,I took I think you're making a very,2858.53,4.12,sbE-emYnHJk
1242,important point and everybody feels it,2861.03,3.66,sbE-emYnHJk
1243,at the moment this is a very rough time,2862.65,5.13,sbE-emYnHJk
1244,in in politics there's a lot of feeling,2864.69,6.29,sbE-emYnHJk
1245,at the moment and I think on prejudice,2867.78,5.94,sbE-emYnHJk
1246,Islamophobia anti-semitism what were,2870.98,4.03,sbE-emYnHJk
1247,doing in our party is having an,2873.72,4.11,sbE-emYnHJk
1248,independent inquiry into into anybody,2875.01,5.1,sbE-emYnHJk
1249,who's guilty of any such offence and and,2877.83,4.59,sbE-emYnHJk
1250,there are at first bounce if they are if,2880.11,3.6,sbE-emYnHJk
1251,they're if they're if they're guilty I,2882.42,3.38,sbE-emYnHJk
1252,think when it comes to the protection,2883.71,5.67,sbE-emYnHJk
1253,particularly of a female MPs and women,2885.8,5.83,sbE-emYnHJk
1254,in politics it's vital that we give them,2889.38,5.01,sbE-emYnHJk
1255,the security that they they need them,2891.63,4.5,sbE-emYnHJk
1256,and we're doing a huge amount in the,2894.39,5.94,sbE-emYnHJk
1257,House of Commons to deliver that what we,2896.13,6.69,sbE-emYnHJk
1258,need to do is we need to come together,2900.33,4.56,sbE-emYnHJk
1259,as a country we've been going at this,2902.82,3.06,sbE-emYnHJk
1260,for too long,2904.89,2.58,sbE-emYnHJk
1261,and that one of the things and that this,2905.88,3,sbE-emYnHJk
1262,is I really am afraid this is my key,2907.47,3.45,sbE-emYnHJk
1263,point tonight the scratchiness of,2908.88,4.32,sbE-emYnHJk
1264,politics the bitterness the acrimony is,2910.92,4.56,sbE-emYnHJk
1265,a function of our inability to get,2913.2,4.89,sbE-emYnHJk
1266,brexit understood almost specific point,2915.48,5.7,sbE-emYnHJk
1267,that we are can do it and we will all,2918.09,6.15,sbE-emYnHJk
1268,can be out on January 31st and end what,2921.18,5.13,sbE-emYnHJk
1269,I think is misery for the come on the,2924.24,3.6,sbE-emYnHJk
1270,specific body about Islamophobia and,2926.31,2.73,sbE-emYnHJk
1271,then I'm going to turn to mr corbyn on,2927.84,4.14,sbE-emYnHJk
1272,anti-semitism you say people come out at,2929.04,5.1,sbE-emYnHJk
1273,first bounce but you have candidates,2931.98,5.43,sbE-emYnHJk
1274,have retweeted Tommy Robinson talking,2934.14,6,sbE-emYnHJk
1275,about quotes muslim paedophiles and a,2937.41,4.53,sbE-emYnHJk
1276,former chair of the Conservative Party,2940.14,4.5,sbE-emYnHJk
1277,says we have a serious and deep problem,2941.94,6.3,sbE-emYnHJk
1278,with Islamophobia yeah sorry very very,2944.64,5.84,sbE-emYnHJk
1279,quickly with all those all those,2948.24,4.44,sbE-emYnHJk
1280,candidates have either apologized are,2950.48,3.55,sbE-emYnHJk
1281,now subject to it,2952.68,4.65,sbE-emYnHJk
1282,investigation and you know I don't want,2954.03,5.85,sbE-emYnHJk
1283,to unnecessarily draw comparisons with,2957.33,4.56,sbE-emYnHJk
1284,the Labour Party but I do think it,2959.88,3.66,sbE-emYnHJk
1285,extraordinary that in this election,2961.89,3.6,sbE-emYnHJk
1286,we've heard for the first time in,2963.54,4.56,sbE-emYnHJk
1287,history the the chief rabbi say that he,2965.49,5.1,sbE-emYnHJk
1288,fears for his community in this country,2968.1,5.04,sbE-emYnHJk
1289,i were mr corbyn to be elected and i,2970.59,3.78,sbE-emYnHJk
1290,think it's a quite extraordinary state,2973.14,2.67,sbE-emYnHJk
1291,of affairs Jericho but it is,2974.37,2.94,sbE-emYnHJk
1292,extraordinary isn't it that the leader,2975.81,3.33,sbE-emYnHJk
1293,of a religious community has to warn,2977.31,3.78,sbE-emYnHJk
1294,people about you and your party,2979.14,4.53,sbE-emYnHJk
1295,anti-semitism is wrong and totally,2981.09,4.74,sbE-emYnHJk
1296,unacceptable in our society in our,2983.67,4.32,sbE-emYnHJk
1297,parties in our political life and the,2985.83,4.89,sbE-emYnHJk
1298,history of the awful trip to the Jewish,2987.99,4.14,sbE-emYnHJk
1299,people in the 19th century in Germany,2990.72,3.72,sbE-emYnHJk
1300,indicates exactly where that kind of,2992.13,4.08,sbE-emYnHJk
1301,language and that kind of racism leads,2994.44,3.42,sbE-emYnHJk
1302,us to there is no place for it,2996.21,3.9,sbE-emYnHJk
1303,whatsoever anywhere in our party or our,2997.86,4.65,sbE-emYnHJk
1304,society and there never will be as far,3000.11,6.39,sbE-emYnHJk
1305,as I'm concerned you see what Jewish,3002.51,6.45,sbE-emYnHJk
1306,matters of the Labor Party say is if,3006.5,4.5,sbE-emYnHJk
1307,this was black or Asian people who were,3008.96,4.62,sbE-emYnHJk
1308,victims of racism you would listen to,3011,6.06,sbE-emYnHJk
1309,them but when Jews say that your party,3013.58,5.73,sbE-emYnHJk
1310,under your leadership is infected with,3017.06,5.1,sbE-emYnHJk
1311,anti-jewish hatred you say no no I know,3019.31,3.45,sbE-emYnHJk
1312,better,3022.16,3.48,sbE-emYnHJk
1313,I don't know better than anybody I,3022.76,5.7,sbE-emYnHJk
1314,listen to people and amend if necessary,3025.64,5.22,sbE-emYnHJk
1315,the rules and processes I'm the leader,3028.46,4.71,sbE-emYnHJk
1316,that introduced an investigation process,3030.86,4.38,sbE-emYnHJk
1317,introduced a disciplinary process,3033.17,3.86,sbE-emYnHJk
1318,introduced a process of Education,3035.24,3.78,sbE-emYnHJk
1319,introduced a process for dealing with,3037.03,4.09,sbE-emYnHJk
1320,egregious cases and yes we have,3039.02,4.62,sbE-emYnHJk
1321,suspended or expelled members where we,3041.12,4.89,sbE-emYnHJk
1322,have found them guilty of anti-semitic,3043.64,4.83,sbE-emYnHJk
1323,behavior as indeed other parties have,3046.01,4.34,sbE-emYnHJk
1324,done the same but there are problems of,3048.47,4.32,sbE-emYnHJk
1325,Islamophobia within our society also as,3050.35,4.51,sbE-emYnHJk
1326,you quite rightly draw attention to and,3052.79,4.23,sbE-emYnHJk
1327,there are problems of language that is,3054.86,5.01,sbE-emYnHJk
1328,used I do not ever use racist language,3057.02,5.82,sbE-emYnHJk
1329,in any form to describe anybody in this,3059.87,6.12,sbE-emYnHJk
1330,world or in our society as we say in the,3062.84,5.61,sbE-emYnHJk
1331,world we treat people with respect you,3065.99,3.66,sbE-emYnHJk
1332,same end up,3068.45,4.08,sbE-emYnHJk
1333,I think he's clearly saying mister,3069.65,5.73,sbE-emYnHJk
1334,Johnson if you want to reply I missed,3072.53,4.29,sbE-emYnHJk
1335,that but let me race it and get let me,3075.38,4.05,sbE-emYnHJk
1336,let me respond by saying that I think,3076.82,4.77,sbE-emYnHJk
1337,that mr. Cogley I'm sure is very very,3079.43,3.81,sbE-emYnHJk
1338,well intentioned but I think that in,3081.59,3.15,sbE-emYnHJk
1339,these handling of this particular issue,3083.24,5.46,sbE-emYnHJk
1340,his unwillingness to take a stand to,3084.74,7.68,sbE-emYnHJk
1341,stand up for the Jewish people in the,3088.7,4.32,sbE-emYnHJk
1342,labour party,3092.42,2.43,sbE-emYnHJk
1343,he's our willingness to protect them to,3093.02,3.78,sbE-emYnHJk
1344,put an armed run is it in my view a,3094.85,4.41,sbE-emYnHJk
1345,failure of leadership you cannot be,3096.8,5.31,sbE-emYnHJk
1346,neutral on questions like this anymore,3099.26,5.1,sbE-emYnHJk
1347,in my view then you can try to lead this,3102.11,4.74,sbE-emYnHJk
1348,country and be neutral on the issue of,3104.36,5.52,sbE-emYnHJk
1349,brexit and it's and and it is it is a,3106.85,5.67,sbE-emYnHJk
1350,failure to take a stand and to have a,3109.88,4.95,sbE-emYnHJk
1351,point of view that in the end will cost,3112.52,5.91,sbE-emYnHJk
1352,this country gravely and deeply and I,3114.83,5.73,sbE-emYnHJk
1353,don't want to waste another year next,3118.43,6.05,sbE-emYnHJk
1354,year and more in in vacillation and,3120.56,6.57,sbE-emYnHJk
1355,confusion about what sort of position,3124.48,5.2,sbE-emYnHJk
1356,mr. Corbyn is willing to take what sort,3127.13,4.88,sbE-emYnHJk
1357,of leadership he's when you fail you,3129.68,4.65,sbE-emYnHJk
1358,leadership is when you use racist,3132.01,4.06,sbE-emYnHJk
1359,remarks to describe people in different,3134.33,3.96,sbE-emYnHJk
1360,countries or in our society I will never,3136.07,4.08,sbE-emYnHJk
1361,do that in my party will never do that,3138.29,5.4,sbE-emYnHJk
1362,and genitally makes the point that one,3140.15,5.58,sbE-emYnHJk
1363,way to take hate more generally out of,3143.69,4.8,sbE-emYnHJk
1364,politics he argues is to sort this,3145.73,4.98,sbE-emYnHJk
1365,brexit Rao out because it's infecting,3148.49,4.44,sbE-emYnHJk
1366,our politics whatever your view is it,3150.71,3.99,sbE-emYnHJk
1367,breaks it you caused agree with that of,3152.93,3.66,sbE-emYnHJk
1368,course there has to be a solution to it,3154.7,4.08,sbE-emYnHJk
1369,but what's your solution well I've made,3156.59,3.93,sbE-emYnHJk
1370,that quite clear actually I'm not sure,3158.78,9.96,sbE-emYnHJk
1371,if you about the cohesion of the point,3160.52,10.26,sbE-emYnHJk
1372,is about the cohesion of our society,3168.74,4.17,sbE-emYnHJk
1373,I hope the Prime Minister understands,3170.78,4.47,sbE-emYnHJk
1374,the hurt that people feel when they hear,3172.91,4.08,sbE-emYnHJk
1375,remarks and articles that he's written,3175.25,5.01,sbE-emYnHJk
1376,in the past I hope he will regret those,3176.99,5.28,sbE-emYnHJk
1377,and I hope he will understand the,3180.26,4.53,sbE-emYnHJk
1378,importance of all of us using respectful,3182.27,4.59,sbE-emYnHJk
1379,language of all faiths unders all,3184.79,3.78,sbE-emYnHJk
1380,religions and all languages thank you,3186.86,4.11,sbE-emYnHJk
1381,what is a multicultural society which,3188.57,4.35,sbE-emYnHJk
1382,I'm proud to living,3190.97,4.09,sbE-emYnHJk
1383,sorry to interrupt but we got a couple,3192.92,3.37,sbE-emYnHJk
1384,more questions that we want to get,3195.06,2.82,sbE-emYnHJk
1385,through if we've got time our next,3196.29,3.33,sbE-emYnHJk
1386,question is from Katrina Herod I'm,3197.88,4.98,sbE-emYnHJk
1387,pleased Katrina Herod I'm in the era of,3199.62,5.13,sbE-emYnHJk
1388,fake news what punishment do you think,3202.86,4.32,sbE-emYnHJk
1389,is appropriate for elected politicians,3204.75,5.01,sbE-emYnHJk
1390,who lie during political campaigns what,3207.18,6.48,sbE-emYnHJk
1391,punishment is appropriate for elected,3209.76,5.88,sbE-emYnHJk
1392,politicians who lie during political,3213.66,4.83,sbE-emYnHJk
1393,campaigns Boris Johnson well they should,3215.64,6.09,sbE-emYnHJk
1394,they should be they should be made to go,3218.49,8.25,sbE-emYnHJk
1395,on their knees to down the through the,3221.73,6.32,sbE-emYnHJk
1396,chamber of the House of Commons,3226.74,3.42,sbE-emYnHJk
1397,scourging themselves with copies of,3228.05,4.3,sbE-emYnHJk
1398,their their offending documents which,3230.16,4.83,sbE-emYnHJk
1399,claim to prove one thing and actually,3232.35,4.95,sbE-emYnHJk
1400,prove something quite different Jeremy,3234.99,5.04,sbE-emYnHJk
1401,Corbyn I think it's important when,3237.3,4.59,sbE-emYnHJk
1402,people go into an election campaign they,3240.03,3.36,sbE-emYnHJk
1403,put forward a policy of what they're,3241.89,3.12,sbE-emYnHJk
1404,going to do they put forward a policy of,3243.39,3.72,sbE-emYnHJk
1405,how they're going to pay for it and if,3245.01,4.59,sbE-emYnHJk
1406,they don't deliver then there is a,3247.11,4.77,sbE-emYnHJk
1407,democratic process to deal with that in,3249.6,4.11,sbE-emYnHJk
1408,the future that is what democracy is,3251.88,4.17,sbE-emYnHJk
1409,about it's about holding people to,3253.71,4.92,sbE-emYnHJk
1410,account and holding government to,3256.05,4.32,sbE-emYnHJk
1411,account in Parliament and I want to see,3258.63,3.93,sbE-emYnHJk
1412,not a weaker but a stronger House of,3260.37,3.87,sbE-emYnHJk
1413,Commons in the future that holds our,3262.56,3.84,sbE-emYnHJk
1414,government to account to make sure we,3264.24,4.2,sbE-emYnHJk
1415,deliver on the promises of reducing,3266.4,3.42,sbE-emYnHJk
1416,poverty in Britain Thank You Forrest,3268.44,3.99,sbE-emYnHJk
1417,Johnson look at worried that a bleeding,3269.82,4.38,sbE-emYnHJk
1418,British diplomat is resigned today,3272.43,3.63,sbE-emYnHJk
1419,saying that she would no longer wanted,3274.2,4.95,sbE-emYnHJk
1420,to peddle half-truths on behalf of a,3276.06,5.79,sbE-emYnHJk
1421,government I do not trust well I I don't,3279.15,5.1,sbE-emYnHJk
1422,know who you're referring to but what it,3281.85,6,sbE-emYnHJk
1423,shows to me is that we need to move on,3284.25,4.98,sbE-emYnHJk
1424,as a country because there are plenty of,3287.85,5,sbE-emYnHJk
1425,people who are irreconcilably opposed to,3289.23,5.85,sbE-emYnHJk
1426,brexit and I think that actually what we,3292.85,4.18,sbE-emYnHJk
1427,should do is respect the will of the,3295.08,4.32,sbE-emYnHJk
1428,people that people talk about trust in,3297.03,5.19,sbE-emYnHJk
1429,in politics look at the promises that,3299.4,5.04,sbE-emYnHJk
1430,were made repeatedly by mr. Colvin by,3302.22,3.69,sbE-emYnHJk
1431,all the other parties that they would,3304.44,3.06,sbE-emYnHJk
1432,honor the referendum result they're,3305.91,4.35,sbE-emYnHJk
1433,refusing to do it here we stand at this,3307.5,4.5,sbE-emYnHJk
1434,critical moment in our country's history,3310.26,4.83,sbE-emYnHJk
1435,it's our chance on Thursday to honor our,3312,5.55,sbE-emYnHJk
1436,democracy and get thank you very much in,3315.09,4.26,sbE-emYnHJk
1437,it thank you has to be a test,3317.55,4.47,sbE-emYnHJk
1438,thank you very much very briefly mr.,3319.35,4.71,sbE-emYnHJk
1439,goolby there has to be a test on the,3322.02,4.47,sbE-emYnHJk
1440,statements made and so when people paint,3324.06,4.98,sbE-emYnHJk
1441,slogans on the side of a bus that are,3326.49,4.71,sbE-emYnHJk
1442,totally unsustainable perhaps it's time,3329.04,4.89,sbE-emYnHJk
1443,we have an independent monitoring of,3331.2,6.48,sbE-emYnHJk
1444,what goes actually and if you look at,3333.93,5.22,sbE-emYnHJk
1445,the numbers we put on this eyelids look,3337.68,3.9,sbE-emYnHJk
1446,at the gross figure we pay to the EU the,3339.15,4.38,sbE-emYnHJk
1447,number is the number is going up and it,3341.58,3.54,sbE-emYnHJk
1448,is one of the advantages of our deal,3343.53,3.09,sbE-emYnHJk
1449,that we will take back control of our,3345.12,3.69,sbE-emYnHJk
1450,our money our borders our laws our,3346.62,4.53,sbE-emYnHJk
1451,immigration system it's very very clear,3348.81,4.74,sbE-emYnHJk
1452,is there in black and white after 40,3351.15,5.21,sbE-emYnHJk
1453,after 59 minutes we still do not know,3353.55,5.79,sbE-emYnHJk
1454,what mr corbyn's deal with me and we,3356.36,4.72,sbE-emYnHJk
1455,still don't know whether he would back,3359.34,4.08,sbE-emYnHJk
1456,it we and we'd nor do we know who in his,3361.08,4.56,sbE-emYnHJk
1457,shadow cabinet he is proposing to deploy,3363.42,4.65,sbE-emYnHJk
1458,to negotiate that deal Bank is one of,3365.64,4.47,sbE-emYnHJk
1459,them actually that's it thank you very,3368.07,4.98,sbE-emYnHJk
1460,much a day now that's all the time we've,3370.11,5.13,sbE-emYnHJk
1461,got for questions now each leader has,3373.05,3.75,sbE-emYnHJk
1462,got 30 seconds for their closing,3375.24,3.72,sbE-emYnHJk
1463,statement again the order was decided by,3376.8,4.41,sbE-emYnHJk
1464,the toss of a coin Boris Johnson chose,3378.96,4.41,sbE-emYnHJk
1465,to go last so can ask Jeremy Corbyn the,3381.21,4.86,sbE-emYnHJk
1466,Labour Party leader to make your closing,3383.37,5.16,sbE-emYnHJk
1467,statement mr corbyn people say that,3386.07,5.43,sbE-emYnHJk
1468,politics doesn't change anything but it,3388.53,6.15,sbE-emYnHJk
1469,can it was a radical labour government,3391.5,5.04,sbE-emYnHJk
1470,that created our National Health Service,3394.68,4.77,sbE-emYnHJk
1471,and rebuilt Britain today we must be,3396.54,5.88,sbE-emYnHJk
1472,ambitious on the same scale the future,3399.45,5.76,sbE-emYnHJk
1473,really is ours to make together we can,3402.42,5.79,sbE-emYnHJk
1474,tackle the climate emergency end child,3405.21,5.55,sbE-emYnHJk
1475,poverty and properly fund our National,3408.21,4.5,sbE-emYnHJk
1476,Health Service on Thursday,3410.76,5.01,sbE-emYnHJk
1477,you can choose hope and vote for real,3412.71,5.4,sbE-emYnHJk
1478,change Thank You mr. Gordon is to,3415.77,4.74,sbE-emYnHJk
1479,Johnson your closing statement please,3418.11,5.4,sbE-emYnHJk
1480,this Thursday we can choose another hung,3420.51,4.98,sbE-emYnHJk
1481,parliament under mr. Corbyn and Nicola,3423.51,4.41,sbE-emYnHJk
1482,Sturgeon with too chaotic referendums or,3425.49,5.22,sbE-emYnHJk
1483,else we can get for exit done get out of,3427.92,5.13,sbE-emYnHJk
1484,neutral and get a parliament that works,3430.71,4.62,sbE-emYnHJk
1485,for you and on your priorities the NHS,3433.05,4.14,sbE-emYnHJk
1486,"the cost of living 20,000 more police",3435.33,4.8,sbE-emYnHJk
1487,more cash for our schools let's get it,3437.19,3.51,sbE-emYnHJk
1488,done,3440.13,2.73,sbE-emYnHJk
1489,let's move on and vote conservative on,3440.7,6.15,sbE-emYnHJk
1490,Thursday thank you for Asansol Thank You,3442.86,5.29,sbE-emYnHJk
1491,Jeremy call,3446.85,3.37,sbE-emYnHJk
1492,now the debate is far from over it's,3448.15,4.8,sbE-emYnHJk
1493,raging on social media hashtag BBC,3450.22,4.47,sbE-emYnHJk
1494,debate it's starting now on five live,3452.95,4.32,sbE-emYnHJk
1495,where Stephen Nolan will take your calls,3454.69,5.97,sbE-emYnHJk
1496,you can have your say by calling Oh 8 o8,3457.27,7.74,sbE-emYnHJk
1497,5 909 6 9 3 on the BBC News Channel,3460.66,6.57,sbE-emYnHJk
1498,Kristian favor is just next door in the,3465.01,4.17,sbE-emYnHJk
1499,spin room and don't forget of course you,3467.23,3.75,sbE-emYnHJk
1500,can watch all the election results live,3469.18,4.05,sbE-emYnHJk
1501,with you Edwards on BBC one next,3470.98,6.21,sbE-emYnHJk
1502,Thursday evening beginning at 955 that,3473.23,6.57,sbE-emYnHJk
1503,is it from here in Maidstone my thanks,3477.19,4.77,sbE-emYnHJk
1504,to the two party leaders thanks to the,3479.8,4.47,sbE-emYnHJk
1505,audience too and thanks to you for,3481.96,4.3,sbE-emYnHJk
1506,watching a very good night,3484.27,7.519,sbE-emYnHJk
1507,[Applause],3486.26,5.529,sbE-emYnHJk
1508,thanks to me for screaming bitch I mean,3493.11,4.5,sbE-emYnHJk
1509,what happened for thanking me with a,3496.35,3.66,sbE-emYnHJk
1510, all these scrounges in my room,3497.61,5.04,sbE-emYnHJk
1511,don't have TV licences clearly should be,3500.01,4.44,sbE-emYnHJk
1512,deported from the country you know what,3502.65,3.95,sbE-emYnHJk
1513,I mean immigrants,3504.45,5.94,sbE-emYnHJk
1514,anyway I've got no idea one cuz I,3506.6,5.53,sbE-emYnHJk
1515,technically wasn't paying attention I,3510.39,5.63,sbE-emYnHJk
1516,never do many idiots or no sir,3512.13,6.21,sbE-emYnHJk
1517,but seems you fucktards were paying,3516.02,4.48,sbE-emYnHJk
1518,attention who do you think won one for,3518.34,2.97,sbE-emYnHJk
1519,Jezza,3520.5,4.65,sbE-emYnHJk
1520,Chifa Boris spam away now you're lots of,3521.31,6.09,sbE-emYnHJk
1521,spam but if you do it in caps locks any,3525.15,4.08,sbE-emYnHJk
1522,caps like you will get banned quickly,3527.4,3.9,sbE-emYnHJk
1523,you can say Tommy Robinson I don't do,3529.23,3.6,sbE-emYnHJk
1524,caps lock in my room if you don't have,3531.3,3.24,sbE-emYnHJk
1525,to type correctly on the computer,3532.83,5.73,sbE-emYnHJk
1526, off basically anyway enjoy which,3534.54,7.02,sbE-emYnHJk
1527,one won or spam which one would I guess,3538.56,5.43,sbE-emYnHJk
1528,and I'll kind of do a scientific poll,3541.56,4.29,sbE-emYnHJk
1529,which means I'll try and read which one,3543.99,9.03,sbE-emYnHJk
1530,spans the most have a lot of people once,3545.85,9.42,sbE-emYnHJk
1531,swam away edition laughter you know and,3553.02,4.32,sbE-emYnHJk
1532,you only get one spam don't spam,3555.27,4.32,sbE-emYnHJk
1533,one or two about a billion times that,3557.34,4.02,sbE-emYnHJk
1534,doesn't help them calculate in my mind,3559.59,7.47,sbE-emYnHJk
1535,who won spam away there's so many Tories,3561.36,7.62,sbE-emYnHJk
1536,and Labour Party supporters we got in,3567.06,6.66,sbE-emYnHJk
1537,the room three doesn't count to say you,3568.98,11.27,sbE-emYnHJk
